"Yeah about 10 years ago I had a horrifying experience. It was 100% their fault but they hit the water barrels and survived. They had no injuries but they almost ran me off the road.	oh wow , that is terrifying ! i am so sorry to hear that ."
"Nothing in life is certain, the only control you have is to decide what to do with the time that has been given to you.	that is great , i am sure you will be able to be able to get it back to be ."
"I have just bought a ticket to a britney spears live show in vegas.	i am sorry to hear that . i have never heard of the same thing ."
"The show is in three months, I hope she sings he late 90s hits.	i agree , i have never been to experience with my husband and i had a fan of my husband and i had a fan of my husband and i had a few years ago ."
"Our Property Management team just emailed me to say I've got the apartment I wanted!	that is awesome ! what kind of property ?"
"It really was - I can't wait to move in! It's a smaller apartment, but quieter (I hope!).	i have never been to move on the house ."
"You'll get there. It really is nice to have your own space. Do you live at home?	i hope you get a good time to get a new place ."
"Good for you! Start saving your money now - believe me, you'll need it!	I was on the patio and a giant roach crawled out from underneath.	oh no ! did you clean up ?"
"It was almost as bug as a golf ball I felt like throwing up.	i have never heard of the same ."
"I have quite a long drive ahead of me next month. It's about 1/12 hours, but I've don it before so I'll be fine.	that is awesome ! i am sure you will be able to get it up ?"
"I put music on and open the window. Otherwise I'll disappear into my own little world, and that's not a good thing to do when you're driving!	i am sorry to hear that . i have never heard of it ."
"It really helps to pass the time, not to mention it can calm you down. And the drive's quite easy and very pretty, which help.	I was so amped yesterday. I got to pick up my now computer for the store!	that is awesome ! what did you do ?"
"It was just a new model HP that I bought but I'm so excited!	i have never heard of it . i have never heard that ."
"I get my groceries delivered to my home and am so grateful for the service.	that is great ! what kind of food is it ?"
"It helps me a lot as I'm disabled and it can be quite difficult. Anyway, I hate grocery shopping!	yeah , i am glad you are happy"
"Ugh. And don't even get me started on ""mini-shoppers"" racing round the aisles screeching! Much better to have someone else buy for me!	I just watched the notebook, pretty depressing movie.	i have never been depressing for it ."
"It's a romantic love story. Doesn't end so well for the main character.	i have never heard of it ."
"my little boy learned how to  count to ten eeven know he is super young	that is so nice . i am so sorry to hear that ."
"yeah i was so proud of him as well i thought i would have to wait months till he got to that point	that is a great time ! i bet he was a great time to have to be able to get a kid !"
"I just went to the park today.	that is awesome ! what did you do ?"
"I was going to hang out, but I ended up tripping and smashing my toe up into a rock.	oh no ! i hope you did not get hurt ."
"my little brother dumped a glass of water on me this morning to wake me up	that is terrible . did you get a good time ?"
"yeah i was furious we are in some sort of a prank war	i am sorry , i hope it was not a good thing"
"Last night there was a really strange animal screaming outside my window in the middle of the night	oh no ! i have never seen that ."
"Turned out to be a skunk! It sounded so strange!	that is scary !"
"When I was in college I travelled all over Europe one semester.	wow , that is awesome ! what did you do ?"
"I love all over Italy, but I also loved Germany and France and Spain.	that is awesome ! i bet you are excited !"
"Yes it was truly an amazing time meeting people from so many different cultures	We went on vacation and the kids stayed home. I couldn't believe it when I walked in the door and the house was totally clean.	that is nice . i hope it was not a good idea ."
"Wonders never cease to amaze me. First time for everything I guess, lol	i am sorry to hear that ! i hope it is not a good idea !"
"I totally thought the same thing. Too funny (but you might be right)	i am sorry to hear that ! i have never had to go to the time !"
"I went ziplining the other day	oh wow ! did you ride ?"
"I found it using the Internet.  It was a lot of hiking but they had a lot of long lines.	i bet that was scary ! i bet you were terrified !"
"Yes I did - I had a great time and met some fun people.	I smashed my finger in the door last night	oh no ! what did you do ?"
"I iced it up but I was so mad because it was my fault for slamming the door	i am sure you will get better !"
"We might have to put our dog down soon.	oh no , what happened ?"
"Yes, she's getting older and she's just getting to that point she can't move around good.	i hope you have a good time ."
"i am really lucky that my cancer got cured many years ago	that is great ! i am so happy for you !"
"i did it with chemo and it took a lot of time and effort	that is so good . i hope you are able to get it up to be a good feeling ."
"I am so ready to move.	that is awesome ! what are you going to do ?"
"California. I'm ready for my kids to try out some new schools and be happier :)	i am sure you will be able to move on the schools to the schools ."
"i cannot stand seeing people throw trash on the streets	i would be so mad !"
"i know right i feel like doing that every time but i dont want to get arrested hahaha let karma get them,	i think that would be a good thing to do"
"I am by myself most of the time in a isolated area. I only have animals as my friends.,5|5|4_5|5|5,	that is a good thing to have to have to animals ."
"Sometimes it makes me sad, but than I think how happy my animal friends makes me feel.	i am sorry to hear that ."
"I bought 100 packs of magic cards and didn't get a single good card.	oh wow , that is a great idea ."
"Collectible cards. My friend bought only a few packs and got incredible cards.	i love magic ."
"I feel really bad that we have to board our dog when we go on vacation next week.	oh no ! what kind of dog is it ?"
"We are going to a place at the beach that doesn't allow pets with some friends. Our vet also has a kennel there to board dogs so I guess that's what we'll do. She'll be so sad though.	i am sorry to hear that , i hope you have a pet is okay ."
"I actually recently applied for a few jobs myself, Crossing my fingers for something better than my current one.	i am sure you will be fine ."
"Current job doesn't pay enough, I'm waiting for the stars to align and something better to come along.	i hope you will get a good job ."
"I just bought some tickets to win the price at the state fair.	that is awesome ! what did you do ?"
"I know its not likely but I really want to win the new mustang	i am sure you will get better"
"I am so scared to live in my neighborhood. There is people that come around shooting their guns.	that is a good idea . i have never heard of those people like that ."
"I have been thinking about moving but I have lived here for over 30 years. The area has changed so much.	i have never seen that . i have never seen that ."
"My fear is that I wont find a safer place. Not much money to find a good neighborhood to move into.	I went out to the country to gaze at some stars.	oh wow ! that is awesome ! what did you do ?"
"I was overwhelmed by the enormity of the universe.	that is awesome ! i bet you were overwhelmed !"
"My kids birthday was last weekend, my whole family showed up! they didn't even tell me they were coming	oh no ! that is so nice ! i bet you were so happy for them !"
"Yea, i do. hah. They live a few states away, which is why it was so unexpected. don't see them often.	i am so sorry to hear that ."
"Bought two pairs of shoes recently.	wow ! that is awesome ! what kind of shoes ?"
"Yeezy's, the worst part is the second pair of shoes were both right footed.	oh wow ! that is awesome !"
"I read the instructions to set up my fit bit 100 times.	that is great , i am sure you will be fine ."
"I need it to work perfectly I need to get ready for a marathon and I need it to track my progress.	that is good . i hope you did not get it fixed ?"
"I have a big speech to give.	oh no , what happened ?"
"Well I don't really know many of the people I will be in front of, so hopefully I don't stutter or something.	i think you will be fine ."
"I left my purse at in the seat in starbucks.	oh no ! that is terrible . what happened ?"
"I was in a safe neighborhood so i wasn't worried.	i am sorry to hear that . i hope you did not get it up to the purse ."
"I was able to say the entire alphabet backwards.	oh no ! did you get it ?"
"no time, I have a great memory, It was on a dare I nailed it perfectly.	i am glad you were able to learn from your memory ."
"I have been looking at pictures of crazy car crashes.	that is so scary ! i am so sorry to hear that ."
"Seriously now I can't drive anywhere. I can't even leave the house for fear of car crashes.	that is good , i hope you are not too ."
"I was at the mall yesterday. I sat down for a few minutes and when I looked away someone stole my shopping bags.	oh no ! that is terrible ! did you get a refund ?"
"No. I didn't notice right away. How could someone do that. Im so so mad!	that is a bummer . i hope you did not get a refund ?"
"I was in a hospital and a guy game in with some really bad burns.	oh no , that is terrible . what did you do ?"
"No idea, but I had never seen something like that in person. It looked painful.	i am sorry to hear that . i hope you did not get it ."
"I saw a guy deadlift 700lbs at the gym the other day. I was in awe.	that is awesome ! i bet you were brave !"
"Yeah it is, it seemed like he had every plate in the gym on the bar. I've never seen someone lift that much in person before.	i am glad you got to get it ."
"I got to go to a cat cafe when no one else was around!	that is a good thing to do that ."
"It was! I was the only one around so all the cats came to spend time with me	i am glad you had a cat was not a good time to go to a cat ."
"I walked out to my car theo ther day and felt something hit my face.	oh no ! what did you do ?"
"A GIANT SPIDER! It was terrible and I was so startled!	oh wow ! that is a scary thing to do that ?"
"When I can home, my cat was laying on the pile of laundry that I had pulled out of the dryer before work. Now it's covered in hair.	oh wow ! that is disgusting ! that is disgusting !"
"Well it's pretty inconvenient, that's for sure. Nothing I can really do about it now. Just got to keep the door closed I guess.	i hope you get a pet ."
"Today when I went into my roommate's office to fix the internet, I noticed the collar of his old cat that passed away. I miss her.	that is so sad . i am sorry to hear that ."
"Yeah, she wasn't my favorite cat, but I still miss her. Cancer sucks.	i am so sorry to hear that . i hope you get a good time to get it ."
"Sometimes an old song runs through my head and I remember the times where I used to listen to songs so many times that I memorized the words	i bet that is great that you are so happy for your old is a good thing to do ."
"Like old kind of emo songs, full of angst and whatnot	i am sorry to hear that . i have never been emo ."
"The other night when I was taking my dog out to go to the bathroom really late. I heard some rustling in the bushes and panicked.	oh no ! that is so cute ! did you have to clean it ?"
"Oh she was ready to fight whatever it was, but she was on a leash thankfully. No, I'm just really easily started, all that anxiety over an armadillo. Im so ashamed lol.	i am sorry to hear that . i hope you get a pet ."
"I found an injured bird in my yard today, it was only a baby to!	that is so sad . i am sorry to hear that ."
"Yes, I had to call my local wildlife rescue center to come get it. I hope its okay, they said they think it has a broken wing.	that is good . i hope you get better soon !"
"I have a friend coming over soon and I keep checking out the window to see if theyre here yet.	that is awesome ! what are you going to do ?"
"I am making dinner for the both of us. I have a roast in the oven. It smells so good I can't wait until it is ready.	i am sure you will enjoy it"
"My boss finally noticed my hard work and gave me a pay raise!	that is awesome ! that is awesome !"
"No not at all! I'm excited because now I can plan a family vacation for this winter.	that is awesome ! i hope you have a great time to have a great time ."
"I have a deadline at work coming up.	that is exciting ! what are you going to do ?"
"It is top-secret. But every time I try and get serious work done, my co-workers won't leave me alone.	that is good . i hope you are okay ."
"My roommate has been gone all week. I don't have anything to do without him here.	that is terrible . i am sorry to hear that . i have been there ."
"It's just not the same doing something by myself. I don't have anyone to go do stuff with.	that is good . i hope you find him ."
"We just adopted a dog from the shelter last week and I think she is sick with parvo.	oh no ! that is terrible ! i am so sorry to hear that . i have lost my dog ."
"It's a deadly dog illness, basically a virus that often leads to death. We think she caught it at the shelter.	i am sorry to hear that . i hope she is okay ."
"Yes, they have to do a fecal sample and test it. We take her in tomorrow to see.	oh , that is so scary !"
"Thank you!	We are planning on going on a cruise in December!	that sounds exciting ! i am sure you will be excited !"
"No, I went on one in highschool but first one with my husband and daughter. It's has been so fun planning it together!	that is awesome ! i bet you are excited !"
"I came home today and my roommate was cooking dinner, all i had to do was fix my plate. It was so nice.	that is awesome ! did you get a good roommate ?"
"I sure did, and the food was delicious. I'll have to surprise him with dinner next time.	i am sure you will get a good roommate !"
"What kind of pizza place is it?	We are suppose to be having a bad storm this weekend.	oh no , i am sorry to hear that . i hope you are okay !"
"Yes, makes you wonder if its global warming. I have been stocking up on food and supplies. Ready for the worst.	i am sure you will be fine"
"My husband just got called back into work, was not expecting that!	that is awesome ! what did you do ?"
"Someone stole some gear, so they called everyone back to investiage. We had just sat down to eat dinner to!	oh wow ! that is pretty gross !"
"He is in the military so technically he can be called in 24/7 and is payed on salary!	I just prepared an amazing plate of mac and cheese.	that is awesome ! what kind of cheese ?"
"It is so good if you add the right amount of pepper.	i am sure you will get better ."
"I just bought a brand new necklace and shirt.	that is awesome ! what kind of necklace is it ?"
"Not sure I just though it looked cool. Hopefully it gets me noticed.	that is awesome ! i bet you are a great necklace is ."
"My dog keeps having accidents in the house! I'm getting fustrated.	that is so sad . i hope you get it out for your dog ."
"Thank you, I will. I think she is doing it to mark her territory, it started when we brought a new dog home.	i am sorry to hear that . i hope she gets better ."
"When I was promoted to Team Leader at work, I really felt like all my hard work had paid off, to some extent, and I gave myself a little pat on the back.	that is great ! i am glad you did not graduate in the future ?"
"Yes, and it can be difficult at times to move up at places, especially when there are many other long timers there!	i am sure you will be fine ."
"I can't wait to go to the water park this weekend.	that is awesome ! i hope you have a great time !"
"Yes, my kids love it so they are going to be so happy when we get there.	i am so happy for you"
"I'm just laying in bed with a scented candle burning in my room and my cat on my lap, things couldn't be any better.	oh no ! i am so sorry to hear that . i have been so scared to clean it up to clean up to clean up to clean up to clean up ."
"Yeah my kitty is just purring away, we're having a good time watching youtube.	that is a good idea"
"My mom sent my daughter a toy I played with when I was a child!	that is awesome ! how old is she ?"
"Yes, it was neat to see her play with it. It'll make some great photos, since I have one of me playing with it at her age.	that is great ! i hope she is a good parent ."
"Six months ago my boyfriend proposed to me and we are getting married next month. I can't wait	that is awesome ! i bet you are excited !"
"On a honeymoon, lol? Not right away. He is totally the man of my dreams. I'm so lucky	i am sure he will be fine ."
"My husband might loose his job, I'm not sure what we will do if he does.	that is great , i am sure he will be fine ."
"The company is downsizing and cutting a lot of departments. His hasn't been cut yet but there are rumors!	that is a bummer . i hope he will get a refund for him ."
"I found out my childhood cat passed away	that is so sad . i am so sorry to hear that ."
"I do too, it was so sad.	i am sorry to hear that ."
"My daughter is such a talented and creative young artist. When she was nominated to be 'Most Artistic' at school, I felt very secure she would win, because she really is amazing!	i am so proud of her . i am sure she will not even if she does not sound like that ."
"She did! I know I'm the parent so can be biased, but it's really so impressive how well she draws, paints, shades....	that is awesome ! i bet she will be able to win ."
"I was very ready for my first car crash	oh no , i am sorry to hear that . what happened ?"
"I had all the paperwork set and ready, I had a blanket cause it was in the winter.	i am so sorry to hear that ."
"Last night a fly got into the bedroom and wouldn't stop trying to land on my face	that is so sad . i hope you are okay ."
"It was terrible! Right as I was about to fall asleep the dang thing would land on my nose!	i would be too"
"I left my dog alone in the house when I went to get the mail. While I was gone she got in the cat box and ate the cat poop, super gross.	oh no ! that is disgusting . did she get caught ?"
"There was nothing to clean.... she definitely swallowed it. I stuck her outside cause I can't even think about dealing with her licking anything right now. Gives me the hebbie jibbes thinking about it.	i would have to clean it out ."
"I have been practicing my speech for days now.	i am so happy for you ."
"I have the perfect delivery and all the talking points drilled down. I will be impressive	that is awesome ! i hope you will be fine ."
"My cat puked up a hairball this morning and I had to clean it up.	oh no , that is horrible ! did you clean up ?"
"She pukes up hairballs every now and then I have some salmon flavored jelly i can feed her, but it happens so infrequently I forget to.	i am sorry to hear that . i hope she was not too"
"When I left the bathroom in high school once I had toilet paper stuck to my shoe.	oh no ! that is terrible . did you get a refund ?"
"Yeah it sure was, you know how mean teenagers can be. It's like they have no empathy or think about what if it was them.	i am sorry to hear that . i hope you did not get it"
"I got a new type of pizza I wanted to try	that is awesome ! what kind of pizza is it ?"
"A normal pepperoni but it was terrible!	that is terrible"
"When I was in Costa Rica I was having a lot of trouble with the address of my AirBnB, I was so lost.	oh no ! that is so scary ! i have never had to go to italy ."
"It was because my Spanish was a bit lacking, it also didn't help that people kept giving me bad directions. I eventually stumbled on it but for a while I was worried I would never make it there.	i am sure you will be able to get it fixed on the costa ?"
"I was caught off guard when the gun fired for a race I was in	oh no ! that is terrible ! did you get hurt ?"
"Yeah, I forgot to take my sweat pants off, that's when I realized running isn't for me	i am sorry to hear that . i hope you did not get a good idea ."
"I slept with a new girl last week	oh no ! that is a good thing to do that ?"
"Not really	i am sorry to hear that ."
"Not really. We were very high. We were drunk. But now I feel bad for my partner	I was eating dinner with my husband last night and I was so happy	that is nice ! did you eat a pizza ?"
"I whole heatedly agree! It was just so freeing and peaceful	i am so sorry to hear that"
"Someone came to my door with a gun the other day.	oh no ! did you get hurt ?"
"I called the police after he robbed me.	that is a bummer . i hope you did not get hurt ."
"No, thankfully, I'm fine but scared.	I left my food on the coffee table and my dog ate it.	oh no , that is a good dog ."
"No, she is fine. I had to find something else to eat though.	i am sorry to hear that . i hope you get better ."
"I was trying to study for a test one night and my brother was listening to loud music	oh no ! what did you do ?"
"I would have totally flipped the circuit breaker if I knew how, but I just asked him to turn it down	i am sure he will be fine ."
"My dog tried to eat her poo	that is a good thing to do that ?"
"It probably will.	that is a good thing to do that !"
"I borrowed a book from the library the other day but I left it outside	that is so nice . did you find it ?"
"Yes it did, unfortunately	i am sorry to hear that ."
"I got something nice the other day, chocolates from my husband	that is nice . what did you do ?"
"It was, and he does that type of thing a lot.	i am happy for you"
"I have problems with the city and their constant tax increase on my property.	i am sorry to hear that . i have not even if i have to deal with that ."
"Maybe A move out of my state would be the answer and a blessing to the high taxes.	i hope you will get a refund ."
"I always do the same, it's not had when they are perfect.	i am sure you will be fine ."
"My girlfriend, How about you? do you have a partner?	that is a good thing to do that you have a good relationship with your girlfriend ."
"Wow. Looks like you are doing a good job.	I close on my new house Monday, I didn't think I was going to be able to purchase it but I believed in my mortgage adviser	that is awesome ! i am glad you are able to get it back to work !"
"Surprisingly it's been a painless process. I'm very thankful.	i am sure you will have a great time to have ."
"I gave my friend some money that she said she would pay back but she hasn't yet.	that is a good friend . what did she do ?"
"I really thought  I could count on her, but now I haven't even heard a word from her. Lesson learned I guess.	i am sure she will be fine ."
"I actually did this, i'm terrible.	i am sorry to hear that . what happened ?"
"I stole my mother's card details to pay for a subscription.	oh no , that is terrible ."
"We are going to Six Flags this weekend and my kids want me to ride the roller coaster with them.	that sounds exciting ! i have never been to be so scared of rollercoasters ."
"I'm really hesitant to get on. It's been a long time since I've ridden one and I don't think I'm going to like it at all	i am sure you will be able to go to the ride !"
"When i lost my dog of 12 years i was devastated...	oh no , that is terrible . how long has happened ?"
"It is a horrible experience and i hope that i never have to go through it again, how did yours die?	i am sorry to hear that . i hope you have a great time to have a pet ."
"I think that in the past i have spent time caring about things that aren't important.	that is great , i am happy for you ."
"Money mostly. I just wish i could have enough of it to be set for life.	i am sure you will be able to find someone else to work ."
"I love thinking back to when I was growing up and the neighborhood we lived in. So many great memories.	i love that feeling nostalgic . i love my family ."
"It really is. All the neighbors were so close, we even spent holidays together. It was like a really huge family all living together.	i have never been to go back ."
"Do you watch any YouTube at all?	i know , i have never seen it ."
"What type of content do you like watching?	i have never heard of it ."
"The other night I wanted cake when I woke up in the middle of the night	oh no , did you have to go back ?"
"The worst part was that there was a cake to be eaten! SO I DID! Lmao	oh wow ! that is a good thing to eat !"
"My husband was teaching me how to make a steak. The flame was so warm!	i love steak . i have never heard of the same way ."
"It was but I was so sad that I was so scared	i am so sorry to hear that . i have never had to go to the same ."
"I looked at my childhood photos the other day. I remember alled the fun I used to ahve	i have never been to experience . i have never heard of it ."
"I do to. It was much easier then for me	i have never been to experience . i have never played it ."
"I have to rely on my prayers and my belief in a high power to get me through not having a job and no money.	i am sorry to hear that . i am sure you will be able to find out for it ."
"I remind myself all the time that it will work out and all will be good again.	i agree . i have never had to work ."
"I was very sad when I found out that my neighbors houses were going to be demolished because the city ordered it..	that is so sad . i have never had to clean it back to clean up"
"Nope. They bought them out at city valued tax prices and they have 60 days to find another place to live.	that is a great idea . i hope you have a great time to have a city with them ."
