"Yeah about 10 years ago I had a horrifying experience. It was 100% their fault but they hit the water barrels and survived. They had no injuries but they almost ran me off the road.	oh wow , that is terrifying ! i am so sorry to hear that ."
"There is many paths leading to faith	i agree , i have never been to experience"
"It takes a path to find ones faith	Are you a parent.	that is awesome ! i am sure you are excited to be able to get a parent ."
"When you become one, you will never forget the day it happens. You'll weep of happiness.	i am sorry to hear that"
"I think i have anxiety attacks! I didn't even know that anxiety causes some physical pain. like the other day i felt like somebody was chocking me	i am sorry to hear that . i hope you can get it out okay ."
"yes! And i felt like that for 3 days on and off!	i am sure you will be fine ."
"We planned our honeymoon and booked a flight but I was so nervous about flying.	oh wow , that is awesome ! what did you do ?"
"I found that out, after many sleepless nights. Now we fly all the time and I love it. I feel kind of silly.	i have never been there . i have never been there ."
"My sister recently paid off her house. I felt so envious of her as I've been trying to pay mine down.	i am so sorry to hear that . i am so sorry to hear that ."
"I really am trying hard to- that's such a great suggestion. I know I'm making good progress to my goal, and I genuinely am pleased she did it!	i am sure she will be fine . i am sure she will get a good time to get a good time ."
"I used to be soooooo territorial of my boyfriend (now husband of decades!) when were dating.	that is a good thing to do that ."
"Yes, but when we were younger -- he didn't really understand. And truly, it was more about my own insecurities than about him, you know? As I grew more into myself, the jealousy loosened its hold.	i am so sorry to hear that . i have never had to talk to him about it ."
"My daughter and her family were on their way from ohio to visit us.	that is awesome ! how old is she ?"
"I prepared for weeks. I could not wait for them to get here. It had been almost a whole year since I had seen them and they have a new baby.	i am sure you will be fine ."
"I cosigned a loan with my son, expecting he would make the payments and he has let me down by being late every month.	that is so sad . i hope he is he a good thing to do that ."
"I've helped me create a repayment plan where I have paid the loan payments and he can catch back up by paying me. I just really feel frustrated because he has the money, but he wastes it.	that is a good idea . i am sure he will be able to pay for you ."
"I was anticipating a great weight loss after my first week on my diet!	that is great ! i am sure you will do great !"
"I lost 7 pounds! I am SO thrilled because it was challenging to follow the plan all week long.	that is great ! i bet you will be proud of your weight ."
"I have felt some of the best moments of pure happiness seeing someone I love getting something they've worked hard for -- like my daughter's acceptance into her college and major of choice!	that is great . i am sure she will be proud of her ."
"Absolutely! Of course, now the real work begins ;-) But her *knowing* that it was her hard work paid off in such a gratifying way -- ah, so happy for her!	i am sure she will be fine !"
"I was disappointed when I realized someone close to me was not who I thought they were.	i am sorry to hear that . did you find someone else ?"
"Well, in a sense. But to be fair, I may have had my own ""vision"" of who they were and held them to that standard -- not really seeing them for who they were. I have to accept some responsibility for that, you know?	i am sorry to hear that . i hope you find someone else to do it ."
"I've definitely worked through that! Happily, it hasn't affected my ability to trust -- just inspired me to be more truthful with myself and others ;-)	I recently met up with a friend I had not seen in a while. I want to see him again soon and I think I will!	that is awesome ! what did you guys do ?"
"I agree. We went to high school and middle school together.	i am sure he will be able to see him ."
"In college I studied very hard for an upcoming exam that I was very interested in getting a very high score. I was confident that I did so.	that is great ! i am sure you will do great !"
"I was very excited with my result. I am very competitive. Sometimes I wish I were not so competitive.	i am sure you will get better ."
"You are completely right. It is very important to not lose sight of what is important in life.	A have a friend that is going to be visiting me this week! I cannot wait!	that is awesome ! what are you going to go ?"
"She was a very close college friend and now she lives a few hours south.	that is awesome ! i bet you are happy"
"I am currently dealing with epilepsy unfortunately, and the doctors have not found a treatment yet.	i am sorry to hear that . i am sorry to hear that ."
"Thanks. I have to go to a Monitoring Unit in two weeks where they will induce seizures to see if they can pinpoint their location. Not going to be fun.	i am sure you will be able to go to the doctors ."
"Thanks again. I have lots of support so I am fortunate	I've felt so incredibly sad whenever we've had to say goodbye to any of our dogs.	i am sorry to hear that . i am sorry to hear that . i have been there ."
"I know -- I needed to just come out and say ""when we had to put them down"". Always age or illness related -- but man, SO tough.	i am sorry to hear that . i hope you are not too ."
"My friend has been on the couch for a few weeks. He is getting under my skin now.	that is so sad . i am sorry to hear that . i hope it is not a good thing to do ."
"No, he is a friend that recently got fired and needs some help.	that is terrible . i hope you find him ."
"I have been trying to lose weight in a group and while i made it to 4 lbs, my friends made it to 15. :(	that is so gross ! i have never had to lose weight ."
"i guess they worked harder but	i am glad you are able to find out there ."
"I went on a road trip with some friends. We had a wonderful time hanging out on the beach and camping, too!	that is awesome ! i bet you were happy to go !"
"Yes, sometimes I leave it away and that makes me appreciate everything else more.	that is awesome ! i bet you are a great time to have to leave the time to go to a while ."
"We paid 600$ for a cruise, but they canceled it with not refunds one week before. so mad	that is so frustrating ! i have never been mad ."
"we are currently pursuing a case against them. they are a local travel company, so they dont know what they're in for	that is a bummer . i hope you have a refund for you ."
"I had a wonderful experience with a friend a few years ago. I wonder if I will see her again any time soon.	that is great ! i am happy for you ."
"We went to the beach and had some fun in the sun and also ate dinner with some other mutual friends.	that is awesome . i am glad you were able to eat it ."
"I live alone. Sometimes it can be hard with nobody around.	i am sorry to hear that . i hope you are not too ."
"I think that's a great idea. I will try to go out this weekend.	i am sure you will get better ."
"I saw a huge spider in my car yesterday. I scared me so!	oh wow ! that is scary ! did you have a spider ?"
"I stopped the car and got out and ushered it out of the car.	i would have been scared of those days ."
"I hope that this summer I can go to Florida with my family	i have never been there , but i have never been there ."
"Summer is not over until Labor Day! We still have the whole month of August!!	that is awesome ! i have been there before ."
"Summer can be over in July for teachers sometimes. Are you a teacher?	My roommate eats my food sometimes. This makes me so angry!	that is so rude . i have not angry , but i would have been angry ."
"I think that's a great idea. I know where to get those fridges for cheap.	i would have to eat some food ."
"I recently lost my sister to breast cancer. She was very young and has left three little girls. I have been devastated.	that is terrible . i am sorry to hear that ."
"My parents health has deteriorated rapidly, and they refuse to go get counseling. It's very sad for me to see.	i am sorry to hear that . i hope you are able to help you and it is a good thing to do that ."
"It's why I think getting a counselor is so important. No one should be expected to go through this on their own.	I was recently rejected by a person that I enjoyed. You can't always get what you want.	that is great . i am glad you were able to get it back ."
"Life is not fair, but it is also amazing in that we are here to begin with	i know , i have never had to go to the fair ."
"I'm a little anxious about an upcoming move. It's to a *very* different state with a *very* different climate and way of life!	i am sure you will be fine ."
"We've been great with change, including a few overseas moves under our belts. But this is to Anchorage! I've read a lot, and there's a lot to be excited about -- but man, those looooong winters!	i am sure you will be fine !"
"Ha! Not likely in the city....but hey...who knows! I WILL use the opportunity to finally learn how to cross country ski.	that is awesome ! i bet you will be a great time to learn from your own ."
"The economy has been doing well. The future looks bright.	that is great , i am sure it will be fine ."
"Hopefully prosperity will carry over into the next few generations.	i am sure it will be fine ."
"My sister unfortunately will not seek help for her alcohol problems, and she will not even admit to them. I am extremely sad apprehensive about what might happen to her.	i am sorry to hear that . i hope she gets better ."
"I have been trying to get my family and her friends to have an intervention, but they have not agreed to it. She really needs one.	i understand , but i have never been apprehensive about it"
"It was still so unexpected when my husband and I -- who were open to getting pregnant -- found out that we actually were!	that is awesome ! how long have you been together ?"
"Oh, that was nearly 20 years ago ;-) But I'll always remember that Chicago day, Halloween, visiting the Shedd Aquarium with friends.	i have never heard of that !"
"The thing I most remember were the beluga whales. So beautiful, in their own weird way -- and a baby beluga had just been born. It seemed provident!	i bet that was a great idea !"
"The horror film I saw last night can cause nightmares. It was so scary!	i have never heard of it . i have been scary movies ."
"I ended up watching The Ring! It was ridiculousness.	oh no ! i have never heard of it ."
"My daughter was accepted into Harvard. She starts in the fall.	oh wow , that is so exciting ! i am so sorry to hear that ."
"She worked so hard and it's really expensive so I hope so!	i am sure she will get better ."
"My friend purchased a new car. The ride is sweet!	that is awesome ! what kind of car is it ?"
"They ended up getting a Honda Prelude.	oh wow ! that is awesome !"
"I graduated college recently. I'm so glad!	that is great ! what are you going to celebrate ?"
"I majored in environmental engineering!	that is great ! i bet you will be proud of yourself !"
"I cheated on my girlfriend recently. I feel horrible about myself right now.	i am sorry to hear that . i hope you are not feel bad ."
"I plan on coming clean at some point, but I'm not sure how to break the news.	i am sorry to hear that . i hope you will find a good way to get a good time ."
"I can not wait until some of my family come in to town. They will be coming in to town in two weeks.	that is awesome ! what are you going to go ?"
"I saw them last summer which seems so long ago. I am very excited to see them because I am very close to them.	i am glad you are happy for them ."
"I often get nostalgic when I think back to my high school years. I had some very good friends.	i am so sorry to hear that . i have been friends like that ."
"Yes, I talk with several of them. I wish I had time to keep up with and talk to more though.	i am sure you will be able to talk to them about it ."
"I saw a horror film last night! It was such a scary experience!	i am so sorry to hear that . i have been there before . i have never heard of it ."
"A young girl would come out of the TV if you watched a video.	i am so sorry to hear that ."
"I am not really a sentimental person but I always feel so special when my husband takes me back to the place we spent our anniversary	that is great ! i am sure you will be happy for you !"
"Yes, it is a very private Bed and Breakfast and we try to go back as often as we can.	i am sure you will be able to go back ."
"I was devastated when I recently had to my chihuahua Riley to sleep.  She had Congestive Heart Failure.	oh no ! that is terrible . i am sorry to hear that ."
"Thank you.  She was my constant companion.  I loved her so much	i am so sorry to hear that . i hope she is a good thing ."
"I can not believe that Donald Trump became President. It just goes to show you that anyone can become President in the United States.	i am sure he will be fine ."
"We shall see. I truly believe that he has done some much damage to our country in so many different ways.	i am sure he will be fine ."
"Once I was suppose to go visit my sister and nieces who I hadn't seen in forever but I ended up breaking my heal and big toe and wasn't able to go. I was so upset!	that is terrible . i am sorry to hear that ."
"Yeah, hopefully so.  It isn't healing correctly is the problem or else I would just go in my cast.	i am sure you will get better ."
"Over the summer my family went to Alabama to visit family and I felt a lot of emotions	that is great ! what did you do ?"
"No, I do not live in Alabama. We drove and trip was overall very good as sometimes it can be challenging when driving such a long distance	that is great ! i hope you have a great time to go back ."
"I was recently working on a project where unfortunately, my teammate really didn't pull their weight.	i am sorry to hear that . i hope you did not get a good job ?"
"Yep. Especially when you feel that you get dinged for the overall project. And at the same time, you don't want to complain about it, because it makes *you* look bad!	i hope you get it !"
"I found out yesterday that I have a nest of yellow jacket bees in my front yard. They can be so aggressive.	oh wow , that is a big fan of bees !"
"I will be able to take control of it myself as I have done so in the past. It still makes it difficult because I can not mow the grass until it gets taken care of.	i have not heard of that . i hope you get it ."
"Since that earthquake in the early hours of the morning I realized how badly off I would be if I didn't get an emergency packet together. So that's what I did - cash, water, important documents, a change of clothing.	oh no ! that is terrible ! did you get it ?"
"It was enough to wake me, but not the cat, lol. It just made me realize that the Big One could happen any time and I would have been up the proverbial creek!	i am sorry to hear that"
"Thank you, I will. It's just the price you pay to live in Paradise, right! At least now I won't die of thirst.	I went back to a horse ranch where I owned horses over 20 years ago. Good times	that is awesome ! i bet you were so happy !"
"A paint (Black and white) and a red quarter horse	that is awesome ! i hope you did not get a good time ."
"Horses are hard work but the fun is equal to the work.	The other day I had a flat, but I had my floor jack and 4-way lug wrench in my trunk and was able to get my tire changed and get back on the road within 10 minutes.	oh no , that is a bummer . did you get it back ?"
"I've had so many flats in my life I've gotten quick at changing them.	i am sure you will get a lot of people ."
"One time, my friends were daring me to jump into a very cold spring from a height of around 40 feet. I was nervous, naturally.	oh my , i have been there . i have been there ."
"Yeah, I ended up doing it. I jumped in and missed a rock wall by probably 2 feet. My legs went numb from the cold as soon as I landed.	i am sorry to hear that . i hope you were able to jump into it ."
"My dear friend Kris just started a job at a gorgeous golf resort on the shores of Lake Michigan. The green-eyed monster in me wants sooo badly to be there!	wow , that is awesome ! i hope you have a great time !"
"I am, but it's so gorgeous and it's a fantastic golf course. And I'm stuck here, bored stupid! I know, I'm being selfish.	i am sure you will do great !"
"I'm trying. Thank you for making me feel better - I really do wish him great success and happiness.	I'm so excited about an upcoming move and life change -- it's a move to a verrrry different state, but should be interesting!	that is awesome ! i have been there , but i have been a lot of people like that ."
"Potentially Alaska -- Anchorage, to be specific. We've lived in different places before -- Amsterdam, Zurich, and Hong Kong. And even though it's a US state, it feels foreign somehow!	that is awesome ! i hope you will be able to go to the state of the state of the state of the state of the state of the world ."
"I feel so relaxed and at peace when I meditate	i am so happy for you ."
"No mystic events. I just feel really relaxed and happy.	i am glad you are enjoying your life ."
"My traveling is more like a sleep / trance, or hypnosis	Once, I thought somebody was attempting to break into my house.	oh no ! what happened ?"
"Yes, I was truly frightened. It ended up being okay though. It was actually just a roofer inspecting my roof that nobody told me about.	that is a good idea . i hope you are not sure to do it ."
"I felt so let down by a person who promised me a project -- but then pulled it away at the last minute in a way that was very personal and reactionary.	i am sorry to hear that . i am sorry to hear that ."
"Especially when it's based on emotion versus honoring a commitment. And when they know it has a very real economic impact.	i am sorry to hear that . i hope you are not too ."
"I had to give a presentation in front of my entire University class last semester. I hate presenting things.	that is a great accomplishment . i hope you did not get a great grade ."
"Honestly, I took a xanax beforehand. It was a group presentation also which helped take some of the spotlight off of me.	that is great , i hope you will get a good spotlight and it will be fine ."
"I went to the local Farmers Market and bought some produce from a farm stall. I am disabled and the kind farmer, despite being busy with other customers, took the time to take my purchases to my car. What a wonderful, kind man!	i am so sorry to hear that . i have never had to deal with that ."
"Not at all. They were super nice, and just kept getting together what they wanted to buy. I love living here - such nice people.	i am sure you will get better ."
"Sure! There's plenty of room, lol. Just be sure you like hot, steamy summers and lots of golf fanatics!	i am sure you will be able to get a lot of people ."
"I get your point - used to live in NE Florida myself. Well, this farmer fella is going to get lots of business from me, that's for sure.	I was so afraid of going in my barn because I got stung by a wasp last year in my neck in the barn.	oh no , that is terrible . i hope you did not get hurt ."
"Next time I will get stung somewhere besides my neck	i am sorry to hear that . i hope you are okay ."
"Maybe I should bring a can of wasp spray!	So I work at a UPS Store. I once gave a customer the wrong package that was valued at $700.	that is a good idea . i hope it was not a refund ."
"Luckily, they were customers that we knew really well and they had a mailbox at our store. So they brought it back when we explained what happened. I felt awful though.	i am so sorry to hear that ."
"I've been reminiscing recently about the good old days, when I was a kid and didn't have to worry about bills and expenses.	that is a good thing to do that ."
"Yes! I wished so much that I would be an adult so I could make my own decisions. Now I wish I could have someone else make those decisions for me! haha	i have never had to go to the same thing . i have never had to go to the same thing ."
"I love what I do because it's about both inspiring and empowering people to be their best and to excel at their jobs.	i am sure you will be able to work out for them ."
"I work as a facilitator and team trainer -- mostly with a company who I truly love and respect for walking their talk.	i am sure you will be able to find a good job !"
"I waited for a good friend of mine at a local pub recently - 2 hours I waited. Eventually I got hold of him and he said he couldn't be bothered going out and had forgotten to call. Not too impressed, frankly.	that is awesome ! i hope you guys were able to go back to the time ."
"I bought a pint of beer and a curry and joined another single woman at a table. We had a fine time, but I sure am wondering about my friendship!	i am sorry to hear that . i hope you guys have a good friend ."
"Could be. I just feel he was being rather inconsiderate, which is not something I'd expect of him.	i am sorry to hear that . i hope you guys were able to find him ."
"Kind of what I was thinking. I won't be arranging to meet him again for a while, that's for sure!	I was so envious of my friend when she won from a lottery ticket she bought for a buck.	wow , that is awesome ! i bet you are excited !"
"She won $5,000 and never offered to share.	i bet you were so proud of her !"
"I recently aced a circuits exam that I was very confident in.	that is great ! what did you do ?"
"I wouldn't say naturally smart, it took a good amount of planning to do well. We established a study group about 2 weeks before the test which helped alot.	that is great ! i am sure you will get better ."
"I am anticipating that the limestone mine in my area where I live at will be reclaimed.	that is cool . i hope you have fun !"
"Clean up, stabilize from future collapses, demolish vacant houses open closed roads, and so on	i would have been so scared of that , i would have been so glad you are able to clean up with it out !"
"I had a rather unnerving experience this past winter. Being unable to sleep at 4am, I went outside for a cigarette (I live in an apartment complex). Suddenly, out of the darkness, appeared a tall bulky figure dressed in black. They were coming straight at me!	i have never heard of that , i have never heard of them ."
"Well, I'm in a wheelchair, so can't move too quickly. I just sat looking at them, trying to figure out whether I could reach the broom at the corner of the porch.	i have never seen that . i have never seen that ."
"Well, that would have been an option. The person came right up to my porch and said ""Good morning. Can't sleep either?"" It was my friend and neighbor walking her dog and I didn't recognize her with all her winter gear on. Scared the daylights out of me!	My daughter just got married and moved across the country and is homesick. I've been talking to her every day to make her feel better.	that is so sweet . i have been married ."
"Actually, I did! I moved across the world to Doha, Qatar to teach for a couple of years. Even though my husband and daughter was with me, it was very hard to be away. Have you ever moved far away?	i am glad you are able to teach her to teach her to be a lot of fun ."
"I had to give a presentation in front of my college class and it didn't go so well.	that is terrible . did you get it ?"
"There was a lot of stuttering and red-face going on. Also, technical difficulties.	oh , that is a good thing to do . i am sure you will be able to go ."
"Sometimes when people honk in traffic I don't know whether to get angry or be glad!	i am sorry to hear that . i have not heard of people who do not know what you mean"
"Exactly, I think a lot of people are too cautious while driving, which makes things even less safe	i agree . i have not believe in the road ."
"I recently got accepted to an Electrical Engineering program at my school.	wow , that is awesome ! what did you do ?"
"I was very excited when I found out. Have you ever been accepted to anything that you really wanted before?	that is great ! i hope you are great !"
"I was really frightened the other night. I was home alone and there was a big storm.	that is so scary ! i hope you were able to get it out ok ?"
"Fortunately, it didn't, but there was a LOT of thunder and lightning. I think a lot of places are being hit by storms right now. Please stay safe!	i am glad you got to go through that ."
"I was quite distressed to hear of the passing of Anthony Bourdain. That someone who has given so much joy to a huge number of people should take his own life is just awful.	i am so sorry to hear that . i have never been distressed . i am so sorry to hear that ."
"Indeed. Depression is a terrible disease and there simply aren't enough resources devoted to mental illness, imo.	i am sorry to hear that . i hope he is okay !"
"It is. I read his book Kitchen Confidential. He's been battling addiction and demons all his life. I thought he'd found peace, but I guess not.	My work supervisor came into my store recently. I tucked in my shirt, left home early, and even put my name badge on for the special occasion.	that is awesome ! that must be so exciting !"
"I had a great time keeping my job and not being fired! I was on the ball for his visit.	that is a good thing to have to visit that ."
"I am going to my local amusement park tomorrow and feeling a certain way about it!	that sounds exciting ! i am sure you will be fun !"
