"Yeah about 10 years ago I had a horrifying experience. It was 100% their fault but they hit the water barrels and survived. They had no injuries but they almost ran me off the road.	oh wow , that is terrifying ! i am so sorry to hear that ."
"I was turned down for a job I really thought I'd be a good fit at.	that is great ! what did you do ?"
"Someone else interviewed who had much more experience than I did.	i hope you get a good job !"
"I went to a sketchy part of town once. Just being there put me on edge.	oh no , that is terrible . what happened ?"
"It was for work so I had to do it, but I typically avoid those places as well	i am sorry to hear that . i hope you find someone else to avoid the way ."
"We went to a friend's house the other day for dinner. I was helping her cook. I was following the directions of a recipe and accidentally cracked her baking dish.	oh no ! that is awful ! did she get a good friend !"
"Yes, I did, but she wouldn't even hear of it. She told me it was fine.	that is good . i am glad you did not feel guilty about it ."
"I am looking forward to moving into a easy place to take care of.	that is great ! i am glad you are feeling ."
"No, not moving soon, only wanting to and looking around to see what is affordable.	i am sure you will get a good place to be ."
"So I had an emergency come up for my family and I had enough money to cover it. I feel great for preparing!	that is awesome ! i am sure you will get a good time to get a good time !"
"Definitely! And they are paying me back, so it isn't like I'm losing money either.	i am sure you will get better ."
"I drank a lot of alcohol at my friend's BBQ party, and I ended up puking and passing out. Not my finest moment.	oh no , that is a good thing to do that ."
"Hahahaha! Well, I guess we can make light of even our worst moments.	i am sorry to hear that . i have never been puking ."
"My eldest son just graduated High School I was so proud.	that is awesome ! i bet he was a great parent ."
"It's kind of a surreal feeling tho, hard to accept that he is grown.  Now college is about to start.	that is great ! i am proud of him ."
"The time just flys by doesn't it?  It hard to imagine that they dont need you so much anymore.	So a customer just came into my work and started yelling at me for something that wasn't my fault. I hate when people do that!	i am sorry to hear that . i hope you get it ."
"No, I didn't yell back haha. I would get fired.	that is good , i am sorry to hear that ."
"Retail, yep.	It makes me angry when people never notice me	that is not good , but i am sorry to hear that ."
"Everything. I don't have friends so it's nice to get noticed	i am sure you will be able to get them"
"I get excited when I go swimming	that is awesome ! what are you going to do ?"
"The fact of relaxing in a large pool of water. It just grabs my attention	i have never been to water . i have never heard of the pool ."
"My wife wasn't feeling so well, so I took care of her and made her some soup <3	that is great ! what did she do ?"
"She is much better now! I love her so much, so I try to take good care of her.	i am happy for you . i am happy for her ."
"I am so grateful to my family	that is great , i am happy for you ."
"They help me with whatever I need and they are always their for me.	i am so happy for you !"
"I was surprised when my parents threw me a party	that is awesome ! what did you do ?"
"It really was. I am pretty thankful for them	i am happy for you"
"A big wind storm blew through town and uprooted one of the trees in my yard.	oh no , that is terrible . i hope you are ok ."
"No, but that was my fear. I kept waiting to hear the sound of a branch or tree hitting my roof, or breaking glass.	i hope you get better soon !"
"I took my dog to an agility competition and she ended up winning first place!	wow , that is awesome ! how did you win ?"
"Thanks so much! It did, but she's so hard-working and I couldn't have done it without her.	that is awesome ! i bet you will get a great accomplishment !"
"I was sad when my parents left me	i am sorry to hear that ."
"I stay with my older sister now	that is so sad . i hope you find a good time"
"My brother got a really high-paying job and now spends all his time flaunting his money.	that is awesome ! that is a big difference between you ."
"Not very well! I mostly just stew and complain about it and wish I had his money and lifestyle.	i bet he was a very proud of him ."
"I was disgusted when my food had a hair in it	oh no , that is disgusting ! did you eat ?"
"Yeah I got a refund. They were very sorry about it and I forgave them	oh wow ! that is awful . i hope you did not get it ."
"I was anxious when I went to the theme park	i am sorry to hear that . what happened ?"
"The roller coasters	i bet you were fun !"
"I was furious when my friend made fun of me in front of random strangers.	that is terrible . what happened ?"
"I am not sure. He told me he was sorry afterwards but I didn't listen to him	that is terrible . i am sorry to hear that ."
"I feel so lonely because I have no friends	i am sorry to hear that . what happened ?"
"I haven't. Im too shy and I am scared of what people will say	i am sorry to hear that . i hope you are not too ."
"I was jealous when my girlfriend was talking to other guys	i am sorry to hear that ."
"I do not. I have trust issues	i am sorry to hear that . i have not trust her ."
"I was terrified when I watched that horror film in the theaters	oh no ! i have seen that movie was scary !"
"I did but it was really a challenge for me.	i am so sorry to hear that . i have never seen that ."
"I was sad when my dad died	i am sorry to hear that . i am sorry to hear that ."
"It happened 3 weeks ago	that is so sad . i hope you are okay ."
"I was sad when my wife left me	i am sorry to hear that . what happened ?"
"I just dont know why she would marry me then.	i am sure she will be fine"
"My family and I went to the beach on Tues and spent the whole day there.	that is awesome ! i bet you were happy for your family ."
"One small thunderstorm but other than that great! I'm amazed I didn't really get burnt!	i am glad you are able to get it up to you !"
"When someone talks down to me, it makes me sad	i am sorry to hear that ."
"I am just too shy to say anything. I dont know how	i agree , but i am sure you will be fine"
"I am super joyful when my family comes together to eat dinner	that is awesome ! i am happy for you !"
"Usually once a week. Its a great feeling	i am sure you will be a great time to eat a day ."
"I was surprised when my parents threw me a big party	that is awesome ! what did you guys go ?"
"It was. I had a great time	that is awesome ! i bet you were happy"
"I am so annoyed that people are so mean to other people	i am sorry to hear that . i am sorry to hear that ."
"That is so true! I dont know where this world is heading.	i know , it is not to be a good way to be , but it is not to be a good way to be able to get to go to the world"
"I get so jealous when my parents don't pay me any attention.	i am sorry to hear that . i hope you are not a good parent ."
"I haven't because I don't know how to start that conversation.	i know that feeling . i have never heard of them ."
"I was furious when my dog ate the wires to my Television	oh no , that is terrible . did you get a dog ?"
"Yeah but it will take a few days because I have to wait for my paycheck	i am sure you will get better ."
"So what happens in the middle of the night? I got woken, again, by my upstairs neighbor thumping around. Does she have to be so rude?!	oh no , that is awful . i have never heard of that ."
"No, they don't. Well, this time I've had enough. I've told management I want into another apartment and explained exactly why!	i would be too , but i would have been a little bit of the worst"
"Not really, but the alternative is to go slowly mad. These blessed individuals stomp around day and night, screeching into their cellphones - they're horrible.	I am a very trusting person. It gets me in trouble sometimes.	i am sure you will be better than you , but it is good to have someone else to be trusting ."
"People take advantage of me	i am sure you will do great"
"I'm only 6 months away from having my AA in Healthcare Administration.	that is a bummer . i hope you get a lot of money ."
"I really am, I can't wait to start my new career!	i am sure you will be able to get it out for a new career ."
"Going to the dentist always has me on edge. I hate it!	i am sorry to hear that . i hope you get a good dentist ."
"I know...it's a necessary evil. But it hurts so much!	i am sorry to hear that . i am sure you will be able to go back ."
"One of my very dear friends got his dream job recently. He was so diligent in finding information and contacts. I so respect what he's achieved.	that is great , i am sure he will be able to get it up to you ."
"Well, it takes perseverance and a bit of luck, but you can do it!	i am sure he will be fine ."
"Lol, you and me both. You could always marry a Kardashian!	i am sure he will be fine ."
"Or someone not quite so objectionable :) Seriously though, I'm so happy for K with his new job.	We started watching a Red Sox game near the end and they were losing. Next thing you know, they were ahead four runs.	that is a good thing to do that ."
"Yes, usually I think so too. But this was really fun to watch and we were so happy because it did not look good at first.	i have never heard of that ."
"My car that I hate is going to die soon and I'll be able to get a new one. Score!	i am sorry to hear that . i hope you get a good car !"
"I'm thinking something reliable. Maybe a toyota or mazda.	i am glad you are able to get it fixed ."
"Yesterday my husband opened a window and a HUGE black bug flew in!! I almost died!!	that is awesome ! that is a big deal with that ?"
"heck no, i told my husband to deal with it. i ran in my bedroom and locked the door	i am sorry to hear that . i hope you did not get hurt ."
"Well, don't you know, one of my neighbors who works for AA was in San Francisco recently and saw some Scottish cheese (I'm Scottish). So she bought some and brought it to me. How nice of her to do that!	that is awesome ! i bet you are excited !"
"This particular one was a cheddar and it tends to be from smaller producers and is creamier and more flavorful than the cheeses we typically get here.	that is good , i am sure she will get a good idea ."
"Ooh, I haven't tried Cabot. Must look out for it. The cheddar I normally get is from Tillamook. I think it's from Oregon. Where's Cabot from?	i am sure you will enjoy it ."
"I've never done that. Wonder if there's a cheese factory near me. I'm in NC, where the people almost all seem as nice as my kind neighbor!	i have never heard of that . i have never heard of that . i have never heard of that . i have never had to go to a lot of fun ."
"my brother would've turned 34 today. he died 2 years ago and It still hurts so much	i am so sorry to hear that . i hope he is so happy for him ."
"yes we were. He moved to the different country but we spoke pretty often	i am sorry to hear that . i hope he was not a good thing to do that ."
"I had planned to go to the beach with friends, but it looks like it's going to rain.	that is awesome ! i have been there before . i have been there ."
"Nah, it said there's be thunder and lightning, so looks like we're stuck inside :(	i am sure you will be fine , i hope you are not too"
"I spent last weekend with most of my family, they live out of state and i don't see them often.	i am sorry to hear that . i have been there before ."
"I did, Yes. Work has been hectic lately so i was really looking forward to unwinding with them.	i am sorry to hear that . i hope you have a good time to go back to the time ."
"We ate good food, drank wine and went swimming.	that is good , i am glad you are not happy for them ."
"It was, kind of hot but not enough to complain about.	that is awesome ! i have never been to go to the food ."
"I hate how our country is so divided right now	i agree , i have not seen them ."
"True. I hope we can become less divided in the future and solve things	i am sure you will get better ."
"My father passed away about 2 years ago. It was so very difficult for me and very unexpected. We didn't know he had a life-threatening illness and weren't prepared in any way for his sudden departure from us.	oh no , that is terrible . i am sorry to hear that ."
"Yes, my family and I are close and we were there for each other. But, my sister had passed away around 6 years before, by committed suicide. The last few years have been very difficult.	i am sorry to hear that . i hope you were able to find him ."
"I feel like a terrible sibling right now.	i am sorry to hear that . i hope you are not too ."
"My sister, who lives out of state and i don't see often, was recently in town visiting our dad. I didn't visit with them.	i am glad you were able to go back to visit them ."
"I am going to a concert very soon.	that is awesome ! what concert ?"
"Imagine Dragon and Grace Vanderwhall, do you know them?	i think that is a lot of dragon dragon dragon !"
"Yes she was.	Our new property management person is remarkably efficient. She emailed me details of a conversation we had yesterday. The others promise the earth and don't deliver!	that is great ! i am sure she will get a good conversation ."
"It is. I've been trying to switch apartments for months and this is the first time someone has actually done anything about it.	i am sure she will be able to get a good time ."
"Absolutely! I move September 1st. No more stompy screechy neighbors at 3 am!!	School for my kids started again this past Thursday.	that is awesome ! how old are you ?"
"It was good. I am dealing with a mixture of both emotions about them being back in school. I was happy I had all the supplies, clothes, shoes, and other odds and ends in time.	i am sure you will get a good time with them ."
"I had planned a beach trip about a month before we actually went.	that is awesome ! what did you do ?"
"We went to Virginia Beach earlier this week. I was so giddy up that whole month I could barely contain myself.	that is awesome ! i bet you were happy for you ."
"My husband, 2 kids and my mother. My kids had never been to the beach.	that is awesome ! i bet you were happy with that ."
"I bought a ticket last week for the lottery, when it was over 100 million dollars.	wow , that is awesome ! i bet you were not expecting it ."
"I was so excited watching the numbers being drawn, but no I didn't win. But someone did! I'm sure they were happy.	i am sorry to hear that"
"True, but it would be fun spending that money.	My husband just found out he will start getting a monthly bonus! This was unexpected and great news	that is awesome ! what did you do ?"
"It sure does. It came as a shock, but a pleasant one.	that is great . i am sure he 'll be happy for you ."
"I just went today to visit my son in his new house.	that is awesome ! i bet he was a good thing to have to visit ."
"It was great! He has saved for so long to buy it.	that is great"
"So tonight we are suppose to go eat out as a family but I cant get a single one of my family members to agree on a place.  So frustrating!	i agree , but i have never heard of that ."
"That's actually not a bad idea.  Wish I had come up with that earlier.  It seems everyone wants something different.	i agree . i have never had to eat a few days ."
"Im going to have to sue that for next week.  I think this week they can all go make PB&J since they want to be difficult.	i agree . i think i would have to eat a good idea ."
"I guess that way the wallet wins every once and awhile too!  lol	I'm so happy that it is Friday!	that is great ! what are you going to do ?"
"Somewhat, I work 4 10 hour shifts and have a random off day during the week. Yesterday was my off day. What about you?	that is awesome ! i hope you get a good time !"
"feels disappointed because my friend fights with me	i am sorry to hear that . i am sorry to hear that ."
"no i can't because i love him a lot	i am sorry to hear that . i hope you guys have a good friend ."
"I have Lupus and it is getting worse.  I asked my doctor for a chance to try a new diet I found that is suppose to help me with it.	i am sure you will be fine ."
"yes, but they are quite powerful which I am trying to avoid.  I am already on one and I am hoping that through this diet I can get off b/c the next steps won't be fun	i am sure you will do great . i am sure you will do great ."
"Some time ago, there was a terrible tornado that came through my city. It destroyed many homes, a school and some people died. I was so fearful and petrified it would come by our home and destroy it, or harm my familY!	oh no ! that is scary ! i hope you were able to get hurt ."
"No, they are so awful! They can destroy so much.	i am glad you are okay ."
"My husband took me to get a new wedding band recently	that is awesome ! what kind of band ?"
"I didn't know ahead of time! Mine had broken a bit and he saved up to get me a new one.	that is a great time to have to get a new band ."
"I love the holidays. Driving around looking at decoration is my favorite.	that is awesome ! i have never heard of that ."
"Christmas. It makes me miss my moms decor.	i am sorry to hear that . i have never heard of them ."
"I have a wonderful sister-in-law.  who is always there for me when I need her	that is great ! what are you going to do ?"
"I feel so lucky to have her as a sister-in-law and a friend.  She is always there to offer a supporting ear and encouraging word.	i am so glad you are able to get her to her ."
"A few weeks ago, we finally got a chance to get back to the beach for our vacation. But, it rained several days, so we didn't get to spend as much time at the beach as we wanted, which sucked. We were really looking forward to it.	that is a great time to have a vacation time to go back ?"
"Oh, no, it was about a 7 hour drive! My daughter was quite young when we went and didn't remember the first trip and she's a teenager now. So, a long time since we first went.	i am sorry to hear that . i am sure she will be able to go back to the time ."
"My husband just a promotion at work he was really wanting	that is great ! what kind of promotion is he ?"
"I know..ha ha!  He worked so hard for this and I am so proud of him.	i am sure he will be fine ."
"We took a vacation recently and had to leave my daughter's teenage boyfriend a key to our house so he could take care of the pets. He's a good young man, so we didn't feel uncomfortable anything would come up missing.	that is so sad . i have never been in my life ."
"We didn't have much choice, as we had an outdoor dog and indoor cat, so if we didn't, we'd come back to not having pets. But, I wouldn't just let anybody, that's for sure!	i am sorry to hear that . i hope you guys are not having to clean up with him ."
"My mother-in-law once told a secret of mine that she promised she would never tell	that is so nice . what did she do ?"
"I know it really hurt me and I had to work on trusting her again with other things	i am sure she will be able to find someone else to tell her about it ."
"One night when my children and I came home, I saw a shadow inside! I was so fearful and afraid!	oh no , i am sorry to hear that . i have been there ."
"It was so scary! Luckily, it was actually my shadow! The light made my shadow show up, but it first appeared to be an intruder!	i am glad you were able to find out there ."
"Last weekend, my family and I enjoyed a nice meal together, and then watched a movie. It was a relaxing time at home, just enjoying each other's company.	that sounds like fun ! i have been there before ."
"Yes, it was drama free and a relaxing time.	i love that ."
"My dog, riley had to be put to sleep due to congestive heart failure	that is terrible . i hope you can get better soon !"
"It was one of the hardest things I had to go through but I know that Riley is not suffering anymore so that helps	i am sorry to hear that . i hope you find peace ."
"I didn't tell my friend when her boyfriend hit on me. She was in a bad spot and needed him for financial support, and that's why I didn't tell her. But, I still felt so bad about it.	that is so sad . i am sorry to hear that ."
"Well, she had custody of her handicapped grandchild and no job, plus she was very much in love with him. I thought it would just make things worse for her.	i am sorry to hear that . i hope she does not have a good friend ."
"I am trying a new diet to treat my Lupus.	i am so sorry to hear that . i hope you are not care of food ."
"I am nervous b/c so much rides on if this works or not.  If it doesn't than I have to take some really powerful meds that i would rather not take	i am sorry to hear that . i hope you are okay !"
"There's a coworker that will not follow instructions on work assignments, so she makes many mistakes. It's so frustrating and aggravating, since it causes others more work.	that is terrible , i am sorry to hear that ."
"Exactly! You try nicely to explain it to her over and over, but she won't listen. Such a nuisance!	i agree , it is not to work , but it is not good to work"
"My mother picked my daughter up for school to take in the morning, and found her cat dead. It was so hard for my daughter and made us all very upset.	that is so sad . i am sorry to hear that ."
"Yes, she was only about 9, and loved her cat so much. It broke my heart to see her so upset!	i am sorry to hear that . i hope she was not a good thing to do that ."
"I decided to play the lottery the other day and won.	that is awesome ! what did you win ?"
"Not normally, so I was quite surprised.	i bet you will win !"
"$1000. It was enough to help me catch up on my bills. So I was happy.	that is awesome ! i bet you were happy for you !"
"Thank you, that was the first time I have ever won anything like that. I almost passed out.	I have a bad experience at the supermarket the other day.	oh no , what happened ?"
"Someone backed into my new car.	oh no ! that is terrible ."
"Yes, they ran! I was so mad when I got to the car and saw it.	Many years ago, we were at a friend's house and one of her friend's was there and she was drunk. My husband was very insistent on helping her, but I felt he was being a bit to 'helpful'. It made me a bit angry!	that is so annoying . i am sorry to hear that ."
"Well, she was attractive and at the time, I thought he was thinking that too. But, I know now he was just trying to help her get to a safe place, since she was falling down. But, it was hard to see it at that time lol	that is a good idea . i am sure he will be able to get a new place to be ."
"I had a bad morning when I went to check my mail.	oh no ! did you get it ?"
"Especially when you find your mailbox laying in about 10 pieces after someone knocked it down last night.	i hope you get better ."
"Not really. I live in town, but it's a small town.	oh no , that is a bummer . i hope you find peace ."
"That's a good idea. I might do that. We don't have a camera because we don't normally have any troubles.	that is good , i hope you get better soon ."
"My aunt came to visit today, we went out for mexican food!	that is awesome ! what did you eat ?"
"Yes, kind of upset she was only able to stay in town for a few hours, she is on a road trip!	that is awesome !"
"I have a big exam for college coming up, I have been studying day and night.	that is great ! what do you do ?"
"It is for my molecular biology class, I feel pretty good that I am going to Ace it.	i am sure you will do great !"
"I went and saw a hockey game today, It was really exciting.	that is awesome ! i am glad you were able to get a good time !"
"No, I use to play growing up. I haven't been to a game since graduating highschool.	i am glad you got a great time !"
"I was on a run today, and saw a loose dog but couldn't catch it before it ran off!	that is awesome ! what did you do ?"
"Maybe if you live in Central Texas...haha! But I was so worried about that small dog getting hit!	i am glad you are able to get a pet ."
"I got some bad news today, my dad passed away.	oh no , i am sorry to hear that . what happened ?"
"Thank you, I am a mess. It is still hasn't hit me that he passed away.	i am sorry to hear that . i hope you are not too ."
"Its so quiet in my house, my husband is out of town for work.	that is a good thing to have to be quiet ."
"True, I'm trying but keep hearing creepy noises. Guess I need to turn the TV up louder haha	i would have been creepy ! i have never heard of it ."
"I got some great news today! My husband got a better paying job offer!	i am so sorry to hear that . i am so happy for you !"
"Not sure yet, but itll help us life more comforatbly! We move to his hometown in November when he gets out of Army!	that is awesome ! i am sure he will be able to move on the future !"
"My daughter is in highschool but took a college course this summer and got an A!	that is awesome ! that is great ! how old is she ?"
"That is very good. You should be proud of her.	I ate way too many sweets today!	that is awesome ! did you eat ?"
"Thanks! Being on a diet is hard, espically with family in town!	i am so happy for you !"
"I was running today and felt like this car was following me..	that is awesome ! what kind of car is it ?"
"Yes it was, I think I need to start carrying pepper spray or something	i am glad you got a good time ."
"Im watching the show The Bold Type, my favourtie characters dad died :(	i am so sorry to hear that . i have never heard of it ."
"Yes, it's a great girly drama! Reminds me of Sex in the City but Modern.	i am sorry to hear that . i have never heard of that show ."
